"title","selftext","url","created_utc","subreddit","author"
"With trumps bill passing, will my federal and state grants be taken away?","Yesterday my college sent my aid package, I qualify for the maximum amount of my federal grant and state Pell grant. With trumps new bill, will they be taken away? I’m really worried because these grants pay for the entirety of my tuition and I can’t afford to go without them ","https://www.reddit.com/r/college/comments/1lr129d/with_trumps_bill_passing_will_my_federal_and/","1751577187.0","college","UsefulPast"
"Appealing - school denied my final semester","Hi everyone  
  
I’m writing this post because I recently received news that my school won’t let me proceed to my final semester, and I’m at a total loss. I’m appealing the decision but I don’t know if it’ll work, and I’d really appreciate advice or support.

Here’s my situation:

* I had to undergo two major surgeries for medical reasons at the start of my 6th semester (7 semesters in total).
* I’ve been living alone since both of my parents passed away in 2023. When I began school in 2022, they were alive and I lived with them, so I had financial stability (I was 24 at the time).
* After their death, I’ve been managing everything alone: paying rent, working 80% (4 days/week) just to survive while doing 2.5 days of school and studying weekends for almost weekly exams, doing my assignments etc.
* I’m also undergoing HRT since 2022, which has been medically necessary for me.
* Despite being under extreme stress and depression, I still passed most subjects. I was only half a grade (!!!) short of making it through.
* I had repeated a year before due to the emotional toll (HRT and parents), but I bounced back.
* The school was cold and inflexible about my situation, even when my surgeon had to step in to confirm the surgeries’ importance. They didn't want to let me get my surgeries basically and I had to fight for it.
* I feel this is deeply unfair since I’m six months away from graduating and I’ve fought through things most people thankfully never have to.

I’m appealing the decision, attaching documentation like the surgery confirmation, death certificates (perhaps optional since they're confidential to me), employment records, mail exchanges with my doctors, and more.

Any advice on how to word this better, or similar experiences? Do you think I can receive empathy to my situation?

**TL;DR:**  
School denied my final semester. I lost both parents, live alone, work 80%, had surgeries, and fought through depression + financial hardship. Missed passing by half a grade. I’m appealing with full documentation. Looking for support/advice.","https://www.reddit.com/r/college/comments/1lq84ij/appealing_school_denied_my_final_semester/","1751492301.0","college","TrunksSSJ"
"My parents are taking my degree choice way too personally and it's weird","Swear my mom takes my psychology degree as a direct insult to her life choices like every family gathering turns into backup plan resolutions. Like mother, this IS the plan and dad keeps sending me indeed links for real jobs and I'm just trying to survive organic chemistry over here. Love them but damn, can a person just pursue their interests without it being a whole family crisis like at least tuition stress is way less now so I can actually focus on classes instead of constantly worrying about money. (lucky I won $500 on Stake to pay off my last month myself else they'd pay it but be on my back about it)  
  
The way they act like I chose psych specifically to spite them is sending me lmao. Mom's out here like I could be an engineer while I'm drowning in research papers about cognitive behavioral therapy. Anyone else dealing with family members who think your education choices are a personal vendetta against their parenting? Because apparently wanting to understand how brains work makes me the family disappointment.","https://www.reddit.com/r/college/comments/1lpd1nw/my_parents_are_taking_my_degree_choice_way_too/","1751402989.0","college","xElisaa"
"Should I drop out of university because of mental health? Advice needed.","Hi, Sorry if this is long! I’d greatly appreciate if you took the tiime to read it.

I’m heading into my final year of uni after taking a mental health break, and I’m seriously considering dropping out.

I took a year off after a rough period—my mental health was at an all-time low, I was in a toxic relationship where I was repeatedly cheated on and blamed due to my mental health being a burden, and I lost most of my friends when I left because they only really cared about rent and not me.

For context, i’ve been diagnosed with adhd, depression and anxiety for most of my life and have had a couple attempts during my teenage years. I’ve been on meds for around 8 years now and have recently just started to be consistent with therapy.

Since January 2024 (when i found out about the cheating), I haven’t been able to finish the assignments needed to return. I’ve tried everything—meds, structured routines, new environments—but I can’t focus or motivate myself. It’s like my brain shuts down the moment I try. Before all this, I was doing well and on track for honors.

Now I’m questioning everything. I don’t enjoy my course and can’t picture myself in a 9–5 life. I want to do something more creative, but the guilt of dropping out is crushing—especially since my parents have paid expensive international student fees. I already feel like a failure, and I’m terrified this would confirm it.

I want to get better, but I don’t know if returning will help or just make things worse. I also fear that dropping out would deepen the depression too. I feel completely stuck.

Any advice or support would mean a lot. Thanks 😊","https://www.reddit.com/r/college/comments/1lp987x/should_i_drop_out_of_university_because_of_mental/","1751394119.0","college","Better_Sprinkles_286"
"Where do you find scholarships if you're a non traditional college student?","Over 25 and just finished my associates degree. I have very minimal student loan debt of 10k. Really would love to get my bachelor's degree but I really can't wrap my head around taking out another 20-30k 🙃  i tried looking on scholarship.com but they were either pointed at the military, working parents or very niche things. 
Any suggestions?

ETA: my school doesn't offer many scholarships and again for very niche things.","https://www.reddit.com/r/college/comments/1lojnfq/where_do_you_find_scholarships_if_youre_a_non/","1751318502.0","college","PuzzleheadedAd5586"
"I'm afraid I'm going to lose my mind this upcoming semester","I (F21) just attended orientation for my university. I'm moving hours away from home to a city I’ve visited a grand total of one time.

I'm a psych major who wants to go to grad school. I'm also the obnoxious student who's in 10 different clubs. Last year, while I was still in community college, I balanced Student Media, occasional student government meetings, PTK, helping to organize campus events, and SkillsUSA—all while taking classes, applying to multiple universities for transfer, and working on campus, sometimes up to 20 hours per week.

I blame this on my ADHD, really, because my brain goes, ""HEY, I WANNA DO THAT THING!

So I do the thing... kinda, sorta. I usually procrastinate, barely hold everything together, and break down every so often. But I do get it done, so yay?

So, as I'm leaving for university, I'm unfortunately taking my neuroticism with me. But I'm also severely burnt out. I have been for a while, really.

And yet, I’m actually really excited for school—meeting new people, learning new things, research, all that fun stuff. I have a really weird love-hate relationship with academia.

Unfortunately, I’ve already started stressing out, as orientation has been a huge information overload. Do I apply for internships right now? A job? Volunteer work? Organizations? What’s the appropriate level of proactiveness? Why am I the only loser attending any of the optional sessions?

Anyway, I'm seeing a therapist on Wednesday, but I’d love to hear any advice from people who’ve been in university longer—preferably if you’re anything like me (I’ll pray for you)—on how you manage your schedule between class and extracurricular activities.

Or is any of this stuff even worth it in the long run?","https://www.reddit.com/r/college/comments/1loicnl/im_afraid_im_going_to_lose_my_mind_this_upcoming/","1751315405.0","college","moonchildvii"
"I can't focus on anything, and it's killing me slowly.","I swear, I've tried everything to make myself work on my english assignments. Attempting to schedule my day, isolating myself from any distractions, trying to meditate and refocus myself between studying and working, but every time I just feel more tired and unmotivated to work on anything, even personal hobbies I keep telling myself I want to do. Instead, I just fall back to watching some stupid video or playing some game I'm never good at, and every time, I scream at myself for being such a failure. Every time I try to open my overdue essay, I can't help but feel a awful wave of nauseating regret for what I've done to myself, and even still I cannot seem to focus and work on it.
The few folks I know are much too busy with their schedule to help, and even then, all I get is ""just do it"" or ""use A.I"" (my professors explicitly use a.i detectors).
If things don't go well, then this will be the third college-level english class I've failed, so can someone please give advice on how to get out of this rut I've found myself in.","https://www.reddit.com/r/college/comments/1lohkhx/i_cant_focus_on_anything_and_its_killing_me_slowly/","1751313591.0","college","VNNNNVN"
"I’m switching paths—need help choosing a major.","Hi all, I’m currently studying in Italy in a bachelor’s program called *“Social Innovation, Communication, and New Technologies”*. It’s an interdisciplinary degree mixing computer science, design, and social sciences. I originally picked it with the goal of becoming a UX designer or digital marketer—something job-ready and practical.

But here’s the thing: I’ve realised I don’t want to work in tech or design anymore. What I really care about is **academia**, **research**, and working in institutions like the **EU**, **UN**, **NGOs**, or **think tanks**. I want to do a **master’s (probably abroad)**, then hopefully a **PhD**. Ideally I’d like to end up in Belgium, the Netherlands, or maybe stay in Italy.

Right now, I’m torn about what to do. My current degree feels too applied, and I’m seriously considering switching to something like:

* **Political Science**
* **Sociology**
* **Economics**
* or even **History** (though it feels a bit abstract and less “marketable”)

The upside is that I’m not taking on any debt (I get a stipend) and both my BA and MA would be **fully funded in Italy**, so I have flexibility. I just don’t want to waste time in a degree that won’t get me where I want to be.

So… what major is best for my goals? How do I know what’s truly right for me?

Would love to hear from anyone in similar fields or paths.","https://www.reddit.com/r/college/comments/1lnw8nc/im_switching_pathsneed_help_choosing_a_major/","1751250176.0","college","Thecrazypacifist"
"how to get grades up in a week?","i have a 43 in physics and a 25 in ap english lang. how can i get my grades up in a week? i’m so overwhelmed ","https://www.reddit.com/r/highschool/comments/1lvlump/how_to_get_grades_up_in_a_week/","1752075233.0","highschool","FunnyYak3131"
"Scared to fail","i was in freshmen year and got into alot of trouble and i wasn't focusing and hanging around the wrong crowd idek if i got 1 credit i think i did but thats the most. so i did acellus for my sophomore year ( just ended now were in summer) and my junior year starts this august i havent been on acellus like i thought i would be because its so easy to get distracted and not have motivation to do it since its self paced and they dont push you to work on it... so im thinking abt going back to in person school and doing credit recovery, night school, alternative anything to help me get credits that i missed this past 2 years and i need 44 credits by my senior year. im really disappointed in myself and i feel realllly horrible right now and i've been thinking about my future and the fact that my parents didn't get the education and now im about to let them down by not getting my diploma im really scared and i honestly feel like not being here anymore.. im just lost and i need some hope and advice that can let me know if i can still save my diploma and make my parents happy. im in a really bad situation :(","https://www.reddit.com/r/highschool/comments/1lvgjn4/scared_to_fail/","1752061162.0","highschool","Ok_Concentrate_8845"
"How I finally fixed my broken communication skills (with 5 books that saved me)","I used to feel like I completely lacked communication skills. Even a “how’s your day” could shut down my brain. After getting laid off, I spiraled. Every interaction felt like a test I couldn’t pass. I’d nod and smile while silently screaming at myself to say something. At night, I replayed every awkward moment like a horror movie. I felt broken. So I got help. I worked with a social coach for a full year and what I learned changed everything. If you’ve ever felt like your mind just blanks, this post is for you.

The biggest thing my coach said was this: you’re not boring, you’re buffering. The thoughts are there. Anxiety just blocks them from surfacing. Once I stopped trying to be interesting and started learning how to organize my thoughts, everything shifted.

Here’s what actually helped:

• Anxiety steals your working memory which makes retrieval hard in real time

• Good conversation is about recognizing patterns not inventing new thoughts

• The more present you are the more your energy leads the flow

These 5 books helped me rebuild my social confidence from scratch

[Better Small Talk](https://www.befreed.ai/book/better-small-talk-by-patrick-king) by Patrick King: Patrick breaks down conversations into simple and repeatable stages. This book helped me stop overthinking and start flowing. After reading it I stopped panicking about what to say next and focused more on just being there.

[Smart Talk](https://www.befreed.ai/book/smart-talk-by-lisa-b-marshall) by Lisa B Marshall: This book gave me the actual phrasing structures to sound smoother without memorizing scripts. Reading it on BeFreed made it even easier to digest and apply. I finally felt like I had a roadmap in my head instead of noise.

[Just Listen](https://www.befreed.ai/book/just-listen-by-mark-goulston) by Mark Goulston: Mark is a renowned psychiatrist and coach featured in Forbes. This book taught me how to diffuse defensiveness and make people feel truly heard. The Persuasion Cycle section alone shifted my conversations from awkward to connected. First convo I applied it to? Game changer. 

[How to Talk to Anyone](https://www.goodreads.com/book/show/35210.How_to_Talk_to_Anyone) by Leil Lowndes: This is a classic for a reason. It’s packed with 92 small but powerful tools that actually work in real conversations. It gave me go-to ways to start, maintain, and deepen connections. After reading it, small talk started to feel a lot more genuine and less forced. 

[Influence](https://www.goodreads.com/book/show/22836493-influence) by Robert Cialdini: One of the most famous psychology books ever written. It changed how I think about connection and persuasion. Helped me build rapport and read social cues without second guessing myself all the time. 

If your brain ever goes blank mid conversation you’re not alone and you’re not broken. Read ten minutes a day. Practice just one tool at a time. The more you show up the easier it gets. Real confidence is built through small wins and it’s always learnable.","https://www.reddit.com/r/highschool/comments/1lusg7v/how_i_finally_fixed_my_broken_communication/","1751990541.0","highschool","karma_1264"
"high school is just a waste of time at this point","i know this isnt a hot take or anything but i just cant with high school anymore i just want to go to uni now. just to preface i am not american. i have about one and a half years left until i graduate and the only reason i havent dropped out is because i need university entrance. but its just so pointless to me. i want to be an artist, an illustrator, and nothing im doing in school is helping me reach that goal. if anything its holding me back by draining me of all my time and energy. i know what i want and nothing fulfils me more than creating freely and getting my art out there. not even the painting class i take at school is helping me, because painting isnt my medium (but theres no other visual art choice), and its so damn restrictive. and by restrictive i mean my teacher retconned every single one of my ideas and now im stuck with two panels worth of art i dont give a shit about. i just wish i could freely work on my art and build an actual portfolio without all these stupid subjects up my ass. i already have the university requirements for maths and im well above average for reading and writing. ive just outgrown high school and i dont see a need for it anymore and i want to go straight to uni. i feel so trapped. the school system is so ridiculously outdated and even worse it prides itself on that fact. i hate how everythings run by a bunch of old control freaks who think the world is the same as it was 50 years ago and scoff at me when i say i dont want to work in law or medicine or engineering. this country acts like its so progressive and loves art but thats barely true only on a smaller community level and isnt implemented at all in institutions. im sick of this","https://www.reddit.com/r/highschool/comments/1lufy51/high_school_is_just_a_waste_of_time_at_this_point/","1751950314.0","highschool","Dear_Clue_2717"
"When is it too late or early to start college admissions?","Hello  there humans! I am a rising junior Lowkey terrifying but super excited i just want this year to go by fast, I've started emailing the disability accodindations office just to figure out what they have to offer, to be specific i want to go to RCAD it is one of the best private art schools in America besides calarts which i was looking at but decided on RCAD  My mom usually emails schools and teachers but since my parents don't support my decision with my career,  I'm doing it myself. I was thinking about doing information sessions and scheduling online meetings about finance aid during lunch or breaks at school or doing them in my car since i will have half days my senior year . once i get my car this year im looking at getting hired at bucees so i can make extra money,

i usually get work done in two hours so it would be easier.

If any current juniors or seniors have any good advice or tips please let me know!!

(I currently homeschool this year of for half of this year we don't know yet)

Too add some more my younger sister already has colleges looking at her and shes a freshie, i've always been the kid whos generally bad at school bc of my learning disablitiy, my parents want me to go to community college than transfer to a university but i feel like i will just end up more depressed, i'll get jealous over everyone who is getting college admissions and i get to go to boring community college.","https://www.reddit.com/r/highschool/comments/1luew5b/when_is_it_too_late_or_early_to_start_college/","1751946804.0","highschool","Jazzlike_Region1733"
"What genuinely makes junior year the supposedly worst year of high school?","I am a rising 11th grader and keep hearing the horror that junior years bring and how it is so bad. I am genuinely stressed out for the year because it will be my first year taking AP classes (bio & lang), and I also am involved with time consuming extracurriculars. I just would like some advice for junior year and maybe some insight of what exactly makes it so bad. Thanks!","https://www.reddit.com/r/highschool/comments/1lu8pmm/what_genuinely_makes_junior_year_the_supposedly/","1751928955.0","highschool","polish_idiot10"
"AMA: I almost didn’t graduate, applied to university twice, and still found my path","Hey everyone! I’m a current university business student who, not too long ago, had *zero* clue what I wanted to study or do in the future, almost didn’t graduate from high school, and took an extra year in high school (which means that I had the opportunity to apply to universities twice). 

If you’re a student anxious about upcoming university applications, lost on program choices, or just overwhelmed with school and future planning – AMA!!! I’m happy to share what the process was like, what I wish I knew earlier, some tools and tips that helped, and my experience getting support from career advisors and mentors.

","https://www.reddit.com/r/highschool/comments/1lu7j1i/ama_i_almost_didnt_graduate_applied_to_university/","1751925950.0","highschool","DependentAd7178"
"2 years  work after graduation in china :zero saving only debt ,anyone else?","Graduated uni in 2022. Two years later: zero savings onlydebt.My work history is a mess – short stints in sales, customer service, tutoring... basically any gig to eat. Nothing stable, no career path.

The debt kills me:
1.  Lent 15,000 RMB (~$2k USD)to a client who begged Ghosted me. Gone.
2.  Still owed wagesfrom a tutoring job. Chasing it feels hopeless.

Now I'm job hunting HARD. But China's job market is brutal. Hundreds apply for one spot. My ""non-vertical"" experience gets me instantly rejected. Degree feels worthless.","https://i.redd.it/8vq3dqj9tubf1.jpeg","1752069200.0","Adulting","shaqimashaladi"
"Feeling very lost in life","Hey guys,

I’m 22 years old and I completely feel lost in life. I work in a call center that makes me suicidal. I’m trying to find other jobs and it’s practically impossible. I’m not even sure what to look for because I haven’t had the best luck in jobs. I want to study something and make a career but I don’t even know what to study or what to do with my life.

I’m bipolar and sometimes I get interested in certain things for a while and then suddenly I am not interested anymore. I feel sad all the time. I’m just struggling a lot. I need to get out of call center work and find a career but I am not even sure what to do. I feel like a failure and quite frankly sometimes I barely have the will to live. I wish I could just escape life. I don’t know when it will get better and it’s hard to see the bigger picture most times.

Any advice?","https://www.reddit.com/r/Adulting/comments/1lvj7xy/feeling_very_lost_in_life/","1752068804.0","Adulting","Zealousideal-Ad6981"
"I have absolutely no idea what to do with my life and feel like a failure.","Hey there. I'm F(23) currently attending university. This is my second attempt. I dropped out my first major after 3 semesters, then worked several jobs over the course of a year and earned some money. I moved places. I'm now attending university again, but a different major. It feels pointless. 

Today I was supposed to take an exam. I don't know what exactly happened but I stayed home because I felt like there was no way i'm passing this one anyway. I did study, but I simply have 0 motivation or trust to actually complete it. I don't know if I'll be able to retake it. My family and friends are so supportive and I could never tell them that it's going wrong again. 

I work in a small private owned bookshop which is nice I guess, but this is no help for my future. I like writing poems and wrote a novel since I dreamt about becoming an author when I was younger but I just don't see a point anymore, it's not even good. 

I don't know what to do with my failed life. I can't possibly drop out of university again but i dont think I can force myself to finish either, I have zero qualifications on paper besides regular school and have no clue which direction to go in my career. I work out a lot but I can't turn my hobbies into a job and even though I have a lot of people in my life I feel super lonely and disconnected from all of them. My dating life is non existent not by lack of choices but I just can't be in a healthy relationship right now because I'm a mess. I wanted to have a family at a young age (mid 20s) but that dream is fading away too.

Frankly, I don't know how to figure out what I want in life.

I just needed somewhere to vent since I can't talk to anyone about it. ","https://www.reddit.com/r/Adulting/comments/1lvek1v/i_have_absolutely_no_idea_what_to_do_with_my_life/","1752054029.0","Adulting","Aromatic-West-9727"
