"title","selftext","url","created_utc","subreddit","author"
"Where do you find scholarships if you're a non traditional college student?","Over 25 and just finished my associates degree. I have very minimal student loan debt of 10k. Really would love to get my bachelor's degree but I really can't wrap my head around taking out another 20-30k 🙃  i tried looking on scholarship.com but they were either pointed at the military, working parents or very niche things. 
Any suggestions?

ETA: my school doesn't offer many scholarships and again for very niche things.","https://www.reddit.com/r/college/comments/1lojnfq/where_do_you_find_scholarships_if_youre_a_non/","1751318502.0","college","PuzzleheadedAd5586"
"I'm afraid I'm going to lose my mind this upcoming semester","I (F21) just attended orientation for my university. I'm moving hours away from home to a city I’ve visited a grand total of one time.

I'm a psych major who wants to go to grad school. I'm also the obnoxious student who's in 10 different clubs. Last year, while I was still in community college, I balanced Student Media, occasional student government meetings, PTK, helping to organize campus events, and SkillsUSA—all while taking classes, applying to multiple universities for transfer, and working on campus, sometimes up to 20 hours per week.

I blame this on my ADHD, really, because my brain goes, ""HEY, I WANNA DO THAT THING!

So I do the thing... kinda, sorta. I usually procrastinate, barely hold everything together, and break down every so often. But I do get it done, so yay?

So, as I'm leaving for university, I'm unfortunately taking my neuroticism with me. But I'm also severely burnt out. I have been for a while, really.

And yet, I’m actually really excited for school—meeting new people, learning new things, research, all that fun stuff. I have a really weird love-hate relationship with academia.

Unfortunately, I’ve already started stressing out, as orientation has been a huge information overload. Do I apply for internships right now? A job? Volunteer work? Organizations? What’s the appropriate level of proactiveness? Why am I the only loser attending any of the optional sessions?

Anyway, I'm seeing a therapist on Wednesday, but I’d love to hear any advice from people who’ve been in university longer—preferably if you’re anything like me (I’ll pray for you)—on how you manage your schedule between class and extracurricular activities.

Or is any of this stuff even worth it in the long run?","https://www.reddit.com/r/college/comments/1loicnl/im_afraid_im_going_to_lose_my_mind_this_upcoming/","1751315405.0","college","moonchildvii"
"I can't focus on anything, and it's killing me slowly.","I swear, I've tried everything to make myself work on my english assignments. Attempting to schedule my day, isolating myself from any distractions, trying to meditate and refocus myself between studying and working, but every time I just feel more tired and unmotivated to work on anything, even personal hobbies I keep telling myself I want to do. Instead, I just fall back to watching some stupid video or playing some game I'm never good at, and every time, I scream at myself for being such a failure. Every time I try to open my overdue essay, I can't help but feel a awful wave of nauseating regret for what I've done to myself, and even still I cannot seem to focus and work on it.
The few folks I know are much too busy with their schedule to help, and even then, all I get is ""just do it"" or ""use A.I"" (my professors explicitly use a.i detectors).
If things don't go well, then this will be the third college-level english class I've failed, so can someone please give advice on how to get out of this rut I've found myself in.","https://www.reddit.com/r/college/comments/1lohkhx/i_cant_focus_on_anything_and_its_killing_me_slowly/","1751313591.0","college","VNNNNVN"
"I’m switching paths—need help choosing a major.","Hi all, I’m currently studying in Italy in a bachelor’s program called *“Social Innovation, Communication, and New Technologies”*. It’s an interdisciplinary degree mixing computer science, design, and social sciences. I originally picked it with the goal of becoming a UX designer or digital marketer—something job-ready and practical.

But here’s the thing: I’ve realised I don’t want to work in tech or design anymore. What I really care about is **academia**, **research**, and working in institutions like the **EU**, **UN**, **NGOs**, or **think tanks**. I want to do a **master’s (probably abroad)**, then hopefully a **PhD**. Ideally I’d like to end up in Belgium, the Netherlands, or maybe stay in Italy.

Right now, I’m torn about what to do. My current degree feels too applied, and I’m seriously considering switching to something like:

* **Political Science**
* **Sociology**
* **Economics**
* or even **History** (though it feels a bit abstract and less “marketable”)

The upside is that I’m not taking on any debt (I get a stipend) and both my BA and MA would be **fully funded in Italy**, so I have flexibility. I just don’t want to waste time in a degree that won’t get me where I want to be.

So… what major is best for my goals? How do I know what’s truly right for me?

Would love to hear from anyone in similar fields or paths.","https://www.reddit.com/r/college/comments/1lnw8nc/im_switching_pathsneed_help_choosing_a_major/","1751250176.0","college","Thecrazypacifist"
"Feeling directionless and lost as a senior, need advice","I'm 21 and after this summer I will be going into my senior year of college. I'm a double major, currently pursuing studio art and statistics, and plan to go to grad school for statistics. My issue is less that I don't have any job prospects (even though I don't), and more that I actually have no idea what I want to do for my future. I'm incredibly behind in my statistics degree, but on top of that I don't even think I want to work a stats job for the rest of my life. My main passion is video game concept art but I doubt my ability to succeed in that industry because I know so many talented artists with more internships under their belts and better portfolios, but the thought of doing stats for the rest of my life feels like a drag. I am currently working on looking for a job as a caricature artist, but even with caricature work I'm worried people would look down on me for it since it's not really considered a high skill job, even though I really enjoy doing it and have made some good money off of it in the past. I also doubt my ability to get a job as a statistician. Overall, I feel behind my peers in so many ways, feel lost and directionless for my future, and it's too late to change my major so I just have to graduate. I feel like I'm gonna end up going back to college when I graduate but I don't even know what I would pursue and the thought also makes me feel like a failure. Overall I just feel like I failed at college and that now I'm just too old and I have no job prospects or even any idea of what I want to do for the rest of my life.","https://www.reddit.com/r/college/comments/1lne9t5/feeling_directionless_and_lost_as_a_senior_need/","1751202486.0","college","GaymingRussian"
"I feel like a loser for taking more time to graduate","Trigger warning (in case): Depression   
  
  
TLDR: I failed my first attempt at my bachelors thesis and I am depressed and ridden with guilt and fear of breaking the news to my parents.   
  
Hi everyone, I (22F) started college September 2021 for my bachelors degree in International Business. Currently I am in my fourth and final year and we have to do a thesis and a defense as our final projects with an external company. Unforunately, I got the news recently that I failed my recent attempt at my thesis report so therefore, I won't qualify for a defense, and will have to attend a feedback session next week to get information on how to improve on my next submission which will be in September. Sure, it is only 2 months and that's hardly a delay but I still feel like a loser as people around me of course are passing one by one and are graduating in July which was supposed to be me but not now. 

For more context, the way it works at my uni is to do an internship in my first semester of my fourth year and then a thesis project with preferably the same company or different. Luckily, I was able to get an extension with the company that I was already with as they liked my work and the team also liked me.  
  
This entire process was super difficult as I was working as an intern still at that company 32 hours a week, I also had to attend some classes for uni in between, I was also taking language lessons in between as I was also planning to get a permanent residence card of the country where I am currently located in as I have lived there long enough and are eligible.   
  
I realized too late that I was burning out rapidly and I already struggle with depression and anxiety and my home life isn't great either as I still live with my parents. I honestly dropped the ball during the process. I take full accountability, but it still hurts. I have let down myself, my parents and some lecturers who really believed in me and my potential. I still need to break the news to my parents as well but I am so scared and my mental health has deteriorated so much in the past months that I am also in therapy now with the emergency hotline. 

I do want to graduate. I’ve already been accepted into a pre-master’s program I wanted but I have to postpone that now to the next academic year and also my parents who pay for my tuition have to pay for an extra 2 months and I just feel so guilty. 

Sorry for the long read.","https://www.reddit.com/r/college/comments/1lnar5y/i_feel_like_a_loser_for_taking_more_time_to/","1751190066.0","college","izmepopcornbeach"
"horribly in debt, considering dropping out, generally panicking","so here’s the situation, i have two years of college left (i’m a senior, but i have to stay an additional year.) i’m in a crazy amount of debt, like, at this point we’re creeping up to $100,000. i’m unemployed (not for lack of trying), and to make things worse, my degree is a bachelor’s in screenwriting :) i don’t need to be told how poor the decisions i made are, i’m well aware :))) 

anyways, my work history lies in childcare (working in day cares, pre-schools, stuff like that.) at 21, i would like to get a teaching certification and associates in child development. i’m at a point where i’m not sure what to do. a way out is presenting itself, as i may not get financial aid this year. however, i am genuinely terrified that in the six month grace period i have before i have to start paying back my federal loans, i won’t find a job. and if i don’t have a job, i can’t get my certification and potentially go to a significantly cheaper/community college to get my associates. i feel so stuck because i’ve sunk three years into film, and if i transfer to another school how the hell are my credits gonna transfer. it’s basically all film, it means nothing. i feel so scared and i wish i had a crystal ball. ","https://www.reddit.com/r/college/comments/1ln32ca/horribly_in_debt_considering_dropping_out/","1751161461.0","college","Educational_Steak794"
"Might sound like a nerd...but I miss college. DAE?","It's my first college summer break. School's been out since early May and honestly I feel homesick for school.

Going from a completely full (18 credit!) schedule to a completely empty one has been messing with my head. Drives me into a seasonal depression every year, but worse this year than it has ever been.

Too hot outside, too lonely. I want something to do! I want a regular routine! I love my family but I'm in another state and I miss all my friends and the things I love. I miss the school of music, I miss my (frat) brothers, I miss marching on the field during Saturday nights or losing my voice in the stands at basketball games taunting the other team. I love my family and I'm glad to spend time with them but college has been my home the past year. I felt seen there.

Anyone else feel similarly? I've got another month of this before I go back. I want to enjoy my time (especially given I was burnt out all year long...) but I just miss it all so much.","https://www.reddit.com/r/college/comments/1lmz5wa/might_sound_like_a_nerdbut_i_miss_college_dae/","1751149691.0","college","stepinsideluv"
"Advice for an expecting mom going back to school","Hi everyone! I recently decided to go back to school and I will be starting a consecutive 20 month dental hygiene program in August 2026 and I’m due early 2026. I have a wonderful wife who is going to help in any way possible but I know it’s still going to be a ton of work. I’m wondering if anyone has any study strategies for when you just don’t have the time to sit down with a textbook and read. I’m looking for things that I can do or listen to while caring for a baby. I hope this makes sense😅 any advice at all is appreciated!","https://www.reddit.com/r/college/comments/1lmc4qa/advice_for_an_expecting_mom_going_back_to_school/","1751078387.0","college","Mental_Salad7575"
"I don’t know what to do and need some advice","Hello sorry for any spelling or grammatical errors I’m typing this super late from where I’m at but I need some advice. I’m a rising senior and switched my major from computer science to data science, although they are similar data science at my school has a lot more courses. I’m also a dual major but I’m finishing that major up quickly. I planned on taking 3 more semesters so I could graduate a semester later. However I got super tired and depressed and couldn’t really take any of my classes that semester and withdrew from 2 courses. My biggest fear is that was going to happen again as that semester was super light and I still ended up dropping classes. I planned on taking summer classes so I could catch up. 1 of the courses which I just finished was just a fun class nothing related to my major and taking a calculus 3 course which isn’t going terribly. However I haven’t had a break from classes since my freshman year summer . I found out I start my second semester today technically and I broke down crying unsure if I can even make it through. The break I had was 3 days in between the semester and those were technically exam days.The class doesn’t have the best rating however if I don’t take it this semester I will have to take it this fall with 2 more difficult courses. Either way if I do decide to drop I will overthink and stress about the following semester and repeat my mistakes. Other than that the financial aid aspect is worrying me but I think I can handle that if I do decide to drop. However what really worries me is my mother. She doesn’t mind how long I take on my degree but doesn’t like me dropping classes. I don’t really understand but dropping those classes this winter made her kind of disappointed and I’m already not in a place where I can handle that. However cause of my decisions taking classes this summer, withdrawing those classes was kind of useless. I’m not sure what to do, I just want to graduate and be over with school but I don’t have much experience with jobs, internships, or clubs. It is kind of hard since I commute to school and can’t really attend late events and even if I could I’m just always so tired. My other major doesn’t really have any job prospect without doing an additional degree. My school is extremely rigorous and if I don’t put any effort failing is an option ,since 70% of the course is graded on just exams and there are 2 exams. What even more insane is that this course has a higher rated professor this summer than the fall but when one is rated 2.9 and the other 2.3 are the prospect really great. The class is not transferable and required so I will have to suffer through it to graduate.","https://www.reddit.com/r/college/comments/1llodun/i_dont_know_what_to_do_and_need_some_advice/","1751011646.0","college","Tiredcat640"
"Failing a modern language course class during Summer and need some advice.","Just for a little bit of background, I'm a senior undergraduate in Sociology with 129 credits as of right now with a 3.43 GPA which is decent but could be a whole lot better. I need at least 2 or 3 more semesters before I'm fully done. However I was taking a fast paced 4 week ASL 101 course that ended up being too much for me to handle. I missed the deadline to drop by one day so the options of withdrawal are out of the window
 A similar situation happened back in Summer 2023 when I was majoring in Informatics at the time and ended up failing one class and withdrawing from the other.  I rebounded ever since I switched my major to Sociology during that time. However, this time around I'm aware that my GPA will take a hit but not sure how badly it will be. I don't have any passion in ASL and would like to look into other modern language options. Any type of advice would be very much welcomed.","https://www.reddit.com/r/college/comments/1llhac8/failing_a_modern_language_course_class_during/","1750987129.0","college","Warriors1234"
"Too young for the college experience","I’m 19f. I started college at 16. I was born in the U.S. but raised abroad and returned here alone for school. My first year was rough adjusting to a new country, but sophomore year got better. I made some friends and started enjoying myself more.

Then junior year hit. I took on leadership roles, 18 credits a semester, and stopped going out as much. I got into a relationship but still made an effort to show up for my friends. As everyone turned 21, I slowly got left out. My hangout invites were ignored and people avoided certain conversations around me. I felt out of place, so I pulled back.

I also took a break from social media to focus on school. When the year ended, I realized I was burnt out and felt really alone. No one checked on me unless I reached out first.

My living situation made things worse. I signed a lease with random roommates. One was introverted, the other messy, and we didn’t get along. I gave up trying to connect.

The friendships I do have feel shallow. I went to a small school growing up so making friends came naturally. But I was one of the few Black people where I lived and never fully felt part of the culture. I hoped college in the U.S. would be different, but I don’t feel like I fit into Black spaces here either. I don’t get a lot of the cultural references and it makes me feel disconnected.

I still hang out with my ex because he’s the closest thing I have to a close friend, but that’s not ideal. My parents live abroad, so I’ve had to navigate everything on my own.

Academically and career-wise, I’m doing good. But it’s hard to enjoy any of it without a real community. I’ve worked hard to become more open and social, but I have fewer people around than ever.

Most of my friends have graduated. My peers are turning 21 and I’m scared of being left behind. I even considered getting a fake just to see what that social life is like, but I don’t want to risk my future for that.

I’m getting a car soon and moving into a new apartment. These should be exciting changes, but it’s hard to enjoy them when I feel so isolated. I have so many interests but no one to share them with. People don’t really reach out to me unless they’re trying to flirt, so I feel like I’m bothering people when I start conversations.

How do I navigate this? I want connection. I just don’t know where to find it.","https://www.reddit.com/r/college/comments/1lko2mf/too_young_for_the_college_experience/","1750903052.0","college","tbmee"
"Will I get held back?","Okay so this is really embarrassing but I failed a class this year. I talked to my counselor about it on May 14th and she told me I could either choose this summer or next summer to make it up. I chose next summer like a fucking dumbass. I attempted 5.50 credits this year and I got 4.50. it say on my report card you need a 2.0 gpa (which I did end with) and atleast 5 credits. If I were getting held back they would tell me right?? Also I had no problem doing summer school this summer, I literally don't know why I chose next summer. For details though, I was being bullied and I stopped coming to school in the first semester and tried my best to turn it around second semester. I had honors classes and I'm a freshman. I called my school just to be sure and they said I could speak to my counselor on Monday but I'm surprised I didnt think of this in June. But I do need opinions on if you think they'll hold me back or not.","https://www.reddit.com/r/highschool/comments/1lqvxr9/will_i_get_held_back/","1751564700.0","highschool","Desperate-Hand-5727"
"school makes me depressed","do i even need to explain?","https://www.reddit.com/r/highschool/comments/1lqi8yi/school_makes_me_depressed/","1751522999.0","highschool","P1ss_0"
"Has anyone else used Kollegio to stay organized for college apps?","Not trying to promo anything, just genuinely curious if anyone else has come across a site called Kollegio. I started using it recently because I was feeling super overwhelmed balancing school, apps, and just life in general.

It’s kind of like a digital planner but made for students — you can organize your goals, deadlines, college stuff, and even track your mental health. It’s pretty clean and easy to use. I like how it breaks everything into smaller steps, which makes the whole process feel less scary.

I found it through a TikTok and thought it would be some generic app, but it’s actually helpful. Anyone else tried it? Or have other tools you’re using to stay on top of things?

u/WinnerOk6763","https://www.reddit.com/r/highschool/comments/1lq3pgb/has_anyone_else_used_kollegio_to_stay_organized/","1751481505.0","highschool","WinnerOk6763"
"My summer is miserable, help needed.","Hi, hope everybody's doing well.

I finished my GCSEs three weeks ago, and since I had to do 7 subjects within a year (I am an international student with no prior experience receiving secondary education in the UK which made it even harder for me) I naturally wanted to take a break during the summer holidays. I literally was studying insane amounts every day--I can't even remember a single day off I took last year. Thanks to this relentless grind, I scored 9s in every test, every quiz I took in school. However, quite obviously, I was so burnt out by mid-June. This was especially true bc last year was my first time living abroad away from my parents. So I was defo ecstatic to return home and finally enjoy life.

But guess what my parents decided to hit me with? 2hrs of AS content lesson 6 days a week. Plus they expect me to study 8 hrs every day. According to them those hours consist of: 2hrs lesson + 2hrs ucat practice + 2hrs reading + 2hrs tutor hw. Simply unrealistic!

And when I told them that this was too much, they told me that people my age were studying all day without even getting sufficient sleep. I swear I told my mum I just want to study 4hrs each day, but she started shouting, saying that a high schooler just mustn’t take on that type of complacent attitude.I told my parents I really needed this summer break to wind down in order to prevent burnout next year, hoping for some sympathy from them. But what I heard from them was: “Even though you take the summer off, things won’t be that different next year. And you don’t want people that studied hard over the summer to be better than you, do you?”

Whenever I look at my friends being carefree and enjoying their summer, I have to hold myself from bursting into tears. Studying has become a dreadful chore from something I genuinely had a passion for. And because I need to juggle SO MUCH all at once, I truly cannot focus on one task and I ACTIVELY FEEL my productivity declining.

It's not that I don't want to study or prepare for my future during the holidays. My goal was to immerse myself into dentistry (what I wanna do in uni) and read a lot of related books and articles. Perhaps do some work experience, and lightly skim over A-level content. I wanted to focus less on academics and genuinely have fun for once! But what I have to do right now is defo far away from what I envisioned. I mean, how am I even supposed to maintain my sanity with so much homework and pressure? Even when I asked my parents to reduce lessons they said they already paid the tutor so can't get a refund, and I was being too weak.

What can I do?? My life is miserable, I'm getting nothing done, and I hate how my summer is ticking past filled with rotten time. Genuinely, any advice would be appreciated.

Sorry this kind of turned into a rant. Hope you have a lovely day:)","https://www.reddit.com/r/highschool/comments/1lpw885/my_summer_is_miserable_help_needed/","1751463844.0","highschool","Live_Box_9507"
"Retaking a class","Right now i’m retaking a class that i failed so i was wondering will my GPA go up when i pass this class?","https://www.reddit.com/r/highschool/comments/1lpufd7/retaking_a_class/","1751458929.0","highschool","Both_Principle_2467"
