"title","selftext","url","created_utc","subreddit","author"
"Working 60 hours in early 20s","Who’s with me rn 🙋‍♀️🖐️ it has to be done. Hopefully only temporarily but it’s tough out here. If I can’t afford a social life off of one job might as well get two and work on myself for a few months or so until I’m back on my feet. Lowkey weird tho bc I’ve felt completely disconnected and almost unplugged. Ready to figure out some work life balance. This age is so odd esp post grad or whatever the real world is something else. Who out here in the thick of the gauntlet rn.","https://www.reddit.com/r/GenZ/comments/1lqfebh/working_60_hours_in_early_20s/","2025-07-03 03:26:17","GenZ","LegalWalk1205"
"Anyone else thinking of leaving bc of the Big Beautiful Bill? (among other things)","I (24F) am from an immigrant household, and I am the first member of my family born in the US. Everyone in my nuclear family is a citizen either by birth or naturalization but essentially all of our extended family lives scattered through West Africa.
I feel like I could build a better life and future for myself in Africa sometimes. My family is on the low income/working class side here but we are solidly middle class and upwardly mobile over there accruing generational wealth. I work and live paycheck to paycheck and I am burning out because I don’t feel confident about my future here, especially with this “Big Beautiful Bill”making its way through Congress. 
If I were to move, there would be a place for me to stay, avenues for me to maybe even get my own apartment, find a job, etc with my family’s support. 

I have a US bachelors degree and lots of skills but I’m worried about this huge of a leap. I’m not so close to my extended family and I don’t speak the indigenous language in our country (but I speak French fluently.) 

Also concerned because I am LGBT lol,,,, I just don’t think that I am likely to find long term companionship in the country where I would be moving. That’s the one thing that’s holding me back, but the way the US is going, there are so many more things that are pushing me away.

I have no loyalty to this country, is the thing. I am a 2024 college grad with no debt, no kids, no long term fiscal responsibilities outside of myself.
Other Gen Zers, do you guys ever think about moving elsewhere or pursuing residency/citizenship/careers in other parts of the world? 

Would love perspectives from other first Gen folks like me with family abroad as well.","https://www.reddit.com/r/GenZ/comments/1lq8qja/anyone_else_thinking_of_leaving_bc_of_the_big/","2025-07-02 22:03:59","GenZ","TurnOwn7620"
"On ""Depression Bait"" posts","People out here have been posting about how hopeless things are and I sympathize a lot with it. At the same time there seems to be this strange contingent of people who believe that  hopelessness is something manufactured so that ""x"" group of people can make money.

I don't get how that works, if you believe that could you go more in depth?","https://www.reddit.com/r/GenZ/comments/1lq4e12/on_depression_bait_posts/","2025-07-02 19:05:27","GenZ","No-Reach8954"
"i don't know if it's related but..","i am 17 i don't know if that makes me gen z but born 2008, i am just curious why everyone who is also gen z is like really different from me, they do heavy makeup, use terms that i don't know..it's like i cannot keep up with teenagers my age or i don't understand many stuff, i feel a bit disconnected from other people my age at least those people on the internet or social media, it's like i am supposed to grow up and be like them but i can't..or they know everything and so matured up but i still feel like either too old mentally but too childish at the same time? i am just confused. Am i scrolling through media too much or does people just ""act"" like that on social media? like i am not as experienced as those people if that makes sense..just weird.","https://www.reddit.com/r/GenZ/comments/1lprtsw/i_dont_know_if_its_related_but/","2025-07-02 09:57:41","GenZ","AgitatedBig2398"
"What do you think is the biggest difference between Gen Z and Millennials?","As a Millennial myself I've always seen the two generations as being very similar from a pop culture perspective with the main divider being 9/11, As an 89er Millennial I can only really anecdote from my own perspective and age group. But what the 90s were while living in North America, were peace, prosperity, a gargantuan number of new franchises and lines of toys including video games, board games, card games, and more general electronics like cd players, vcrs, stereos, cds, and a shit tonne of kids movies including disney's white boxed vault movies.

The 90s are a long since past but deeply remembered decade where I just felt safe, innocent, perhaps even ignorant. Not JUST because I was a kid, but because we weren't online all the time and the internet we had back then was barely the internet at all.

What I think I'll say on that note then is that, Millennials are a generation of nostalgia because we actually had a decade of awesome things to be nostalgic about, but Gen Z is a generation that started in a depressed and rotten civilization from the start. They don't fundamentally understand the loss we suffered. In March 2001 my grandparents were able to wait with me while I, an 11 year old and unaccompanied minor waited for my flight from Florida back to Canada. That doesn't happen anymore.

Gen Z were playing as kids what Millennials were playing as teens. In the context of 9/11, that meant war propaganda games like call of duty, halo, time splitters, mass effect, command and conquer, star craft, battlefield, and to some extent grand theft autos as well. Gen Z grew up faster. Because Millennials grew up in a world that catered to kids but Gen Z grew up in a world that catered to adults and wanted you to grow up. This process was sped up by Covid and by the generally more adult pop culture that continues to be cranked out.

That's just me thinking out loud. Thanks for reading.","https://www.reddit.com/r/GenZ/comments/1lpi0zq/what_do_you_think_is_the_biggest_difference/","2025-07-02 00:25:44","GenZ","Straight-Sink-9334"
"Stressed and Confused, how do I keep going?","I’m currently working on my AS-T, on my current path I will be ready to transfer in 2026 Fall with AS-T math & science and Physics. Dual major I know, but I had fun and I’ll meet both requirements. 
I’m really struggling right now, ever since November last year I’ve been unable to get involved or excited by my classes. I feel helpless. 

I’ve had to post pone tests, and once I walked out of a test before it finished because I was so overwhelmed. I had to drop a class for the first time after trying so hard.

Im not a bad student, but I feel like I’m already so behind. I can’t keep up with my workload and I’m introverted as hell. I feel if I don’t keep up with my friends I’ll be left alone. I don’t even know what I want to do. 

My planner is empty, my room is a mess. It’s community college, i was taking calc 2. I didn’t even show up. I know why. I lost insurance this year, just overall unfortunate. But I thought I was stronger than my ailments. 

I don’t know if I should cut my workload, I only have 2 IGETC left and these are my last core classes. I have two classes to retake. Everyone tells me I’m doing great, I just don’t believe it. My body is falling apart and I feel like my brain is a close second.

How do I cope? Spring was really stressful for me and I feel like I hit a slump. I’ve made no friends in my 2 years attending college, and no progress. Don’t say take time off, I nearly lost my life letting myself press pause. 
","https://www.reddit.com/r/college/comments/1lqqe4d/stressed_and_confused_how_do_i_keep_going/","2025-07-03 14:02:39","college","Peaved_bear"
"What the Future is like?","Hello, I need advice, idk if i should start college or not, I don't know what life means i'm lose and slowly fading in the the expectation, and not just expectation the fact the everyday I log in into instagram and see people doing better than me people that appear to have everything sorted out in their life, I just keep falling into this cognitive dissonance saying I'm good but something inside is clearly not happy. 

one of the bigest problem i have right now is the fact that I've meet bunch of people with degrees and bunch of other titles, working in the same job I work. Me a 20y/o man who hasn't find no meaning in life and this +30y/o men and women i work with that went to college just talking about their debt and how they regret it. 

I really want to die Studying something significant i want to do something i can feel good about. but with this prices. should i just keep my job and hope for the best?","https://www.reddit.com/r/college/comments/1lqp4t2/what_the_future_is_like/","2025-07-03 13:07:08","college","East-Philosophy-9635"
"Appealing - school denied my final semester","Hi everyone  
  
I’m writing this post because I recently received news that my school won’t let me proceed to my final semester, and I’m at a total loss. I’m appealing the decision but I don’t know if it’ll work, and I’d really appreciate advice or support.

Here’s my situation:

* I had to undergo two major surgeries for medical reasons at the start of my 6th semester (7 semesters in total).
* I’ve been living alone since both of my parents passed away in 2023. When I began school in 2022, they were alive and I lived with them, so I had financial stability (I was 24 at the time).
* After their death, I’ve been managing everything alone: paying rent, working 80% (4 days/week) just to survive while doing 2.5 days of school and studying weekends for almost weekly exams, doing my assignments etc.
* I’m also undergoing HRT since 2022, which has been medically necessary for me.
* Despite being under extreme stress and depression, I still passed most subjects. I was only half a grade (!!!) short of making it through.
* I had repeated a year before due to the emotional toll (HRT and parents), but I bounced back.
* The school was cold and inflexible about my situation, even when my surgeon had to step in to confirm the surgeries’ importance. They didn't want to let me get my surgeries basically and I had to fight for it.
* I feel this is deeply unfair since I’m six months away from graduating and I’ve fought through things most people thankfully never have to.

I’m appealing the decision, attaching documentation like the surgery confirmation, death certificates (perhaps optional since they're confidential to me), employment records, mail exchanges with my doctors, and more.

Any advice on how to word this better, or similar experiences? Do you think I can receive empathy to my situation?

**TL;DR:**  
School denied my final semester. I lost both parents, live alone, work 80%, had surgeries, and fought through depression + financial hardship. Missed passing by half a grade. I’m appealing with full documentation. Looking for support/advice.","https://www.reddit.com/r/college/comments/1lq84ij/appealing_school_denied_my_final_semester/","2025-07-02 21:38:21","college","TrunksSSJ"
"My parents are taking my degree choice way too personally and it's weird","Swear my mom takes my psychology degree as a direct insult to her life choices like every family gathering turns into backup plan resolutions. Like mother, this IS the plan and dad keeps sending me indeed links for real jobs and I'm just trying to survive organic chemistry over here. Love them but damn, can a person just pursue their interests without it being a whole family crisis like at least tuition stress is way less now so I can actually focus on classes instead of constantly worrying about money.  
  
The way they act like I chose psych specifically to spite them is sending me lmao. Mom's out here like I could be an engineer while I'm drowning in research papers about cognitive behavioral therapy. Anyone else dealing with family members who think your education choices are a personal vendetta against their parenting? Because apparently wanting to understand how brains work makes me the family disappointment.","https://www.reddit.com/r/college/comments/1lpd1nw/my_parents_are_taking_my_degree_choice_way_too/","2025-07-01 20:49:49","college","xElisaa"
"Should I drop out of university because of mental health? Advice needed.","Hi, Sorry if this is long! I’d greatly appreciate if you took the tiime to read it.

I’m heading into my final year of uni after taking a mental health break, and I’m seriously considering dropping out.

I took a year off after a rough period—my mental health was at an all-time low, I was in a toxic relationship where I was repeatedly cheated on and blamed due to my mental health being a burden, and I lost most of my friends when I left because they only really cared about rent and not me.

For context, i’ve been diagnosed with adhd, depression and anxiety for most of my life and have had a couple attempts during my teenage years. I’ve been on meds for around 8 years now and have recently just started to be consistent with therapy.

Since January 2024 (when i found out about the cheating), I haven’t been able to finish the assignments needed to return. I’ve tried everything—meds, structured routines, new environments—but I can’t focus or motivate myself. It’s like my brain shuts down the moment I try. Before all this, I was doing well and on track for honors.

Now I’m questioning everything. I don’t enjoy my course and can’t picture myself in a 9–5 life. I want to do something more creative, but the guilt of dropping out is crushing—especially since my parents have paid expensive international student fees. I already feel like a failure, and I’m terrified this would confirm it.

I want to get better, but I don’t know if returning will help or just make things worse. I also fear that dropping out would deepen the depression too. I feel completely stuck.

Any advice or support would mean a lot. Thanks 😊","https://www.reddit.com/r/college/comments/1lp987x/should_i_drop_out_of_university_because_of_mental/","2025-07-01 18:21:59","college","Better_Sprinkles_286"
"Where do you find scholarships if you're a non traditional college student?","Over 25 and just finished my associates degree. I have very minimal student loan debt of 10k. Really would love to get my bachelor's degree but I really can't wrap my head around taking out another 20-30k 🙃  i tried looking on scholarship.com but they were either pointed at the military, working parents or very niche things. 
Any suggestions?

ETA: my school doesn't offer many scholarships and again for very niche things.","https://www.reddit.com/r/college/comments/1lojnfq/where_do_you_find_scholarships_if_youre_a_non/","2025-06-30 21:21:42","college","PuzzleheadedAd5586"
"I'm afraid I'm going to lose my mind this upcoming semester","I (F21) just attended orientation for my university. I'm moving hours away from home to a city I’ve visited a grand total of one time.

I'm a psych major who wants to go to grad school. I'm also the obnoxious student who's in 10 different clubs. Last year, while I was still in community college, I balanced Student Media, occasional student government meetings, PTK, helping to organize campus events, and SkillsUSA—all while taking classes, applying to multiple universities for transfer, and working on campus, sometimes up to 20 hours per week.

I blame this on my ADHD, really, because my brain goes, ""HEY, I WANNA DO THAT THING!

So I do the thing... kinda, sorta. I usually procrastinate, barely hold everything together, and break down every so often. But I do get it done, so yay?

So, as I'm leaving for university, I'm unfortunately taking my neuroticism with me. But I'm also severely burnt out. I have been for a while, really.

And yet, I’m actually really excited for school—meeting new people, learning new things, research, all that fun stuff. I have a really weird love-hate relationship with academia.

Unfortunately, I’ve already started stressing out, as orientation has been a huge information overload. Do I apply for internships right now? A job? Volunteer work? Organizations? What’s the appropriate level of proactiveness? Why am I the only loser attending any of the optional sessions?

Anyway, I'm seeing a therapist on Wednesday, but I’d love to hear any advice from people who’ve been in university longer—preferably if you’re anything like me (I’ll pray for you)—on how you manage your schedule between class and extracurricular activities.

Or is any of this stuff even worth it in the long run?","https://www.reddit.com/r/college/comments/1loicnl/im_afraid_im_going_to_lose_my_mind_this_upcoming/","2025-06-30 20:30:05","college","moonchildvii"
"I can't focus on anything, and it's killing me slowly.","I swear, I've tried everything to make myself work on my english assignments. Attempting to schedule my day, isolating myself from any distractions, trying to meditate and refocus myself between studying and working, but every time I just feel more tired and unmotivated to work on anything, even personal hobbies I keep telling myself I want to do. Instead, I just fall back to watching some stupid video or playing some game I'm never good at, and every time, I scream at myself for being such a failure. Every time I try to open my overdue essay, I can't help but feel a awful wave of nauseating regret for what I've done to myself, and even still I cannot seem to focus and work on it.
The few folks I know are much too busy with their schedule to help, and even then, all I get is ""just do it"" or ""use A.I"" (my professors explicitly use a.i detectors).
If things don't go well, then this will be the third college-level english class I've failed, so can someone please give advice on how to get out of this rut I've found myself in.","https://www.reddit.com/r/college/comments/1lohkhx/i_cant_focus_on_anything_and_its_killing_me_slowly/","2025-06-30 19:59:51","college","VNNNNVN"
"I’m switching paths—need help choosing a major.","Hi all, I’m currently studying in Italy in a bachelor’s program called *“Social Innovation, Communication, and New Technologies”*. It’s an interdisciplinary degree mixing computer science, design, and social sciences. I originally picked it with the goal of becoming a UX designer or digital marketer—something job-ready and practical.

But here’s the thing: I’ve realised I don’t want to work in tech or design anymore. What I really care about is **academia**, **research**, and working in institutions like the **EU**, **UN**, **NGOs**, or **think tanks**. I want to do a **master’s (probably abroad)**, then hopefully a **PhD**. Ideally I’d like to end up in Belgium, the Netherlands, or maybe stay in Italy.

Right now, I’m torn about what to do. My current degree feels too applied, and I’m seriously considering switching to something like:

* **Political Science**
* **Sociology**
* **Economics**
* or even **History** (though it feels a bit abstract and less “marketable”)

The upside is that I’m not taking on any debt (I get a stipend) and both my BA and MA would be **fully funded in Italy**, so I have flexibility. I just don’t want to waste time in a degree that won’t get me where I want to be.

So… what major is best for my goals? How do I know what’s truly right for me?

Would love to hear from anyone in similar fields or paths.","https://www.reddit.com/r/college/comments/1lnw8nc/im_switching_pathsneed_help_choosing_a_major/","2025-06-30 02:22:56","college","Thecrazypacifist"
"Feeling directionless and lost as a senior, need advice","I'm 21 and after this summer I will be going into my senior year of college. I'm a double major, currently pursuing studio art and statistics, and plan to go to grad school for statistics. My issue is less that I don't have any job prospects (even though I don't), and more that I actually have no idea what I want to do for my future. I'm incredibly behind in my statistics degree, but on top of that I don't even think I want to work a stats job for the rest of my life. My main passion is video game concept art but I doubt my ability to succeed in that industry because I know so many talented artists with more internships under their belts and better portfolios, but the thought of doing stats for the rest of my life feels like a drag. I am currently working on looking for a job as a caricature artist, but even with caricature work I'm worried people would look down on me for it since it's not really considered a high skill job, even though I really enjoy doing it and have made some good money off of it in the past. I also doubt my ability to get a job as a statistician. Overall, I feel behind my peers in so many ways, feel lost and directionless for my future, and it's too late to change my major so I just have to graduate. I feel like I'm gonna end up going back to college when I graduate but I don't even know what I would pursue and the thought also makes me feel like a failure. Overall I just feel like I failed at college and that now I'm just too old and I have no job prospects or even any idea of what I want to do for the rest of my life.","https://www.reddit.com/r/college/comments/1lne9t5/feeling_directionless_and_lost_as_a_senior_need/","2025-06-29 13:08:06","college","GaymingRussian"
"I feel like a loser for taking more time to graduate","Trigger warning (in case): Depression   
  
  
TLDR: I failed my first attempt at my bachelors thesis and I am depressed and ridden with guilt and fear of breaking the news to my parents.   
  
Hi everyone, I (22F) started college September 2021 for my bachelors degree in International Business. Currently I am in my fourth and final year and we have to do a thesis and a defense as our final projects with an external company. Unforunately, I got the news recently that I failed my recent attempt at my thesis report so therefore, I won't qualify for a defense, and will have to attend a feedback session next week to get information on how to improve on my next submission which will be in September. Sure, it is only 2 months and that's hardly a delay but I still feel like a loser as people around me of course are passing one by one and are graduating in July which was supposed to be me but not now. 

For more context, the way it works at my uni is to do an internship in my first semester of my fourth year and then a thesis project with preferably the same company or different. Luckily, I was able to get an extension with the company that I was already with as they liked my work and the team also liked me.  
  
This entire process was super difficult as I was working as an intern still at that company 32 hours a week, I also had to attend some classes for uni in between, I was also taking language lessons in between as I was also planning to get a permanent residence card of the country where I am currently located in as I have lived there long enough and are eligible.   
  
I realized too late that I was burning out rapidly and I already struggle with depression and anxiety and my home life isn't great either as I still live with my parents. I honestly dropped the ball during the process. I take full accountability, but it still hurts. I have let down myself, my parents and some lecturers who really believed in me and my potential. I still need to break the news to my parents as well but I am so scared and my mental health has deteriorated so much in the past months that I am also in therapy now with the emergency hotline. 

I do want to graduate. I’ve already been accepted into a pre-master’s program I wanted but I have to postpone that now to the next academic year and also my parents who pay for my tuition have to pay for an extra 2 months and I just feel so guilty. 

Sorry for the long read.","https://www.reddit.com/r/college/comments/1lnar5y/i_feel_like_a_loser_for_taking_more_time_to/","2025-06-29 09:41:06","college","izmepopcornbeach"
"horribly in debt, considering dropping out, generally panicking","so here’s the situation, i have two years of college left (i’m a senior, but i have to stay an additional year.) i’m in a crazy amount of debt, like, at this point we’re creeping up to $100,000. i’m unemployed (not for lack of trying), and to make things worse, my degree is a bachelor’s in screenwriting :) i don’t need to be told how poor the decisions i made are, i’m well aware :))) 

anyways, my work history lies in childcare (working in day cares, pre-schools, stuff like that.) at 21, i would like to get a teaching certification and associates in child development. i’m at a point where i’m not sure what to do. a way out is presenting itself, as i may not get financial aid this year. however, i am genuinely terrified that in the six month grace period i have before i have to start paying back my federal loans, i won’t find a job. and if i don’t have a job, i can’t get my certification and potentially go to a significantly cheaper/community college to get my associates. i feel so stuck because i’ve sunk three years into film, and if i transfer to another school how the hell are my credits gonna transfer. it’s basically all film, it means nothing. i feel so scared and i wish i had a crystal ball. ","https://www.reddit.com/r/college/comments/1ln32ca/horribly_in_debt_considering_dropping_out/","2025-06-29 01:44:21","college","Educational_Steak794"
