"title","selftext","url","created_utc","subreddit","author"
"Please do not stress — advice from a parent.","I do not use this site often, but I recently stumbled on this subreddit. I've noticed that this forum is fraught with emotion, to say the least.

My second son graduated from high school 4 years ago. He was a superb student, scoring 1590 on his SAT and ranking 2nd of 500 students in his class. He was in the Gold division of the USACO, class president, and the programming lead of a robotics team that placed at the world championship. He is also an avid reader of Chinese literature and writes poetry in his free time, about which he wrote his personal statement. 

Despite him being wholly qualified to go just about wherever he wanted, he was rejected by all but three schools he applied to, all of which were ranked outside the top 30. He was incredibly bitter for months afterwards, especially as his two best friends since second grade both committed to Stanford. He saw his rejections as a judgement that he was somehow intellectually inferior than the students that got into top colleges (which is obviously ridiculous, given his top 0.1% IQ and SAT score).

About 18 months ago, he and a friend dropped out of college to found a tech startup that is currently valued in the nine figures, of which he is the Chief Technology Officer and business lead. Even if his current venture fails, I have no doubt whatsoever that he will succeed. He is a very intelligent, extroverted, and ambitious person. The college he attended will not define him.","https://www.reddit.com/r/ApplyingToCollege/comments/1lvlp52/please_do_not_stress_advice_from_a_parent/","1752074865.0","ApplyingToCollege","Emergency_Bread4628"
"I need advice on what to do next","Hi everyone after two years away from school and a lot of time spent working, I’ve decided reassess my path in life and could use some solid advice. I started college as a nursing major, completing two years of prerequisites at a community college with a 3.9 GPA before beginning university level nursing courses. When the pandemic hit, financial and family pressures piled up, my grades slipped, and I ultimately withdrew from school. Wanting to finish something, I switched to exercise science and earned a bachelor’s degree, though my enthusiasm for the subject faded long before graduation. What was meant to be a one year break afterward turned into two, and during that time I realized my true passion is still nursing. The hitch is that my exercise science GPA doesn’t really reflect the strong work ethic I had in my nursing prereqs, so I’m no longer sure how competitive I look on paper now. Should I apply to a bachelors to masters in nursing  program since I already have a bachelor’s, or try for another traditional BSN program? Also what steps can I take to rebuild my academic profile so that  I stand out? Any guidance or personal experiences would be hugely appreciated.","https://www.reddit.com/r/ApplyingToCollege/comments/1lv8g8k/i_need_advice_on_what_to_do_next/","1752031118.0","ApplyingToCollege","Repulsive_Fortune_25"
"Why did so many undergrad and Master's programs admit me when I didn't end up doing well? (long post)","My post is going to be a bit unusual because I'm (31M) a 5th year PhD student in Experimental Psychology who is about to finish in August. I did horribly in undergrad (3.25 overall GPA), Master's (3.48), and PhD (no publications and my ratings as a full time instructor on all categories was always 1-2s out of 5. Mostly 1s my last semester). I did my undergrad from 2013-2017 and only took 12-14 credit hours per semester as well since I transferred in 26 credit hours with a 3.71 GPA. I also had a 29 ACT as well with the help of a dedicated ACT tutor (90th something percentile at the time I think. Notably, my math score stayed around 22-24 even though everything else went up), 3.75 unweighted GPA (no weighted courses like AP, IB, or honors. No foreign language courses either since it was a school for dyslexic and/or ADHD students and I graduated with a class of 8). Despite all of that, I bombed hard at the ""stoner school"" of my home state despite getting into their Honor's College (which I dropped out of after I got placed on probation for being below a 3.0 GPA after my second year) and getting a generous merit scholarship. Part of my mistake was taking a BS in Psychology, which required math up to Calc II (which I had to retake before I passed). It was also a big part of the reason I chose the school I did because I would've had to take remedial math courses at my flagship university or other universities if I went to them. I also got into an undergrad with a 25% acceptance rate but I didn't go since it was too expensive, even with their merit scholarship and my family didn't qualify for needs based financial aid at all. I only got through the lab courses despite taking in zero information as well because I coasted off of others in my class. I only had one summer's worth of lab experience as well as one year back my senior year of high school.

My parents also paid for a life coach who helped me through all four years of undergrad and (eventually) a different coach who helped me with graduate program applications. It's worth noting that I have autism and other neurodivergent conditions too (ADHD-I, motor dysgraphia, 3rd percentile processing speed) and mental health (social anxiety at the time of undergrad. I later got diagnosed with generalized anxiety, social anxiety, major depressive disorder - moderate - recurrent, and PTSD at 29) so I had accommodations in undergrad other than a note taker for me because I was scared of getting exposed by other students. Internalized ableism at the time also played a role too no doubt since I was afraid of looking like I wasn't doing the work or something to other students. I had 1.5x extended time, quiet room, and allowed to type instead of write on quizzes and/or exams. It's worth noting that my evaluator as a kid listed my autism severity as moderate with supports, but severe without supports based on my lack of ability to manage internal and external distractions, stress, and organization. My self direction is also listed as below average. Studying would also take forever for me usually, so I didn't work during undergrad at all whatsoever.

I only got through my Master's and PhD programs by working with my cohort a lot as well as using notes during what should've been closed note closed book exams for two difficult classes during COVID. There was no Lockdown Browser to keep up accountability so everyone did what I did. Not saying it's right but just putting that out there. I wasn't a good student in my classes nor did I ever work on multiple projects at a time. I was also the only one in my cohort who had a 10 hour assistantship my second year. Everyone else went up to 20 hours because they took a 1 credit hour course to TA their first year of the program. I was the only one who didn't because I was under the impression it was full blown teaching when most TAed for a lab course in reality.

Fast forward to later in my PhD program and my first PhD advisor drops me due to how I managed the lab as well as the thought I could do a PhD but it wasn't my time. We also had a misunderstanding, but I won't elaborate since this post will be long as is now. She also noted that I could do things but that I ""stretch myself"" to reach the same point as others and that ""how I was born"" (she knew my conditions) contributed to what she saw with the lab management. I managed to get an adjunct role after my stipend got cut in half due to budget issues my 3rd year (same tuition waiver that paid off my program thankfully) and a visiting full time instructor role my 4th year when I was newly ABD and collecting dissertation data. I bomb both hard and had ratings that were usually 2s out of 5 before being pulled down to 1s out of 5 on most categories my last semester (I was also partially hospitalized too). Even though I switched to my current advisor in my 3rd year and am graduating this August... I have no publications and I'll be underskilled and overqualified at the same time.

So, to all those colleges who decided to admit me, why if this was going to go poorly? I knew someone in their first year when I was a second year at my Master's program who has similar diagnoses and accommodations as me (he got 2x extended time though) and took 3.25 years to graduate after his Master's advisor dropped him. Why do these things happen?","https://www.reddit.com/r/ApplyingToCollege/comments/1lv5sgx/why_did_so_many_undergrad_and_masters_programs/","1752023144.0","ApplyingToCollege","Aromatic_Account_698"
"Additional Recommender *Advice Needed*","Hey guys. I have an idea for an additional recommender that worked with me for my main EC, but the problem is she doesn't speak good english. That being said, she will probably allow me to write the letter myself. Because of this, I'm worried that there is a chance for admissions officers to contact her and realize she couldn't have written the letter herself. Is this possible or am I overthinking? Do admissions officers ask for contact details of writers and do they contact them?

Thanks and sorry if the question is stupid!","https://www.reddit.com/r/ApplyingToCollege/comments/1luxhnm/additional_recommender_advice_needed/","1752002068.0","ApplyingToCollege","Muted-Meringue-8255"
"Financial Aid advice for a disabled student with parents who both work.","I’m a 21 year old university student in my third-ish year of undergrad going to Canada as an international student. My country of origin is the United States and I live incredibly close to the border. All the schools that accepted me in the US, yes even public schools (my state is generally more expensive overall), were more expensive than going to school in Canada. Tuition alone at a state school here is equivalent to both tuition and room and board at my current institution.

Even though I am so close to finishing up my degree, I may have to drop out due to lack of financial aid.

Let’s just say my family is not quite the genetically blessed bunch; both of my parents, my sister, as well as myself all have medical issues that require we go to multiple specialists. My father has had to get multiple surgeries done in the past five years. For a decent amount of time, I was on disability medicaid through our state’s program, but it has long since expired and has been a pain to reinstate due to the fact that I needed a part time job to help my family pay off our regular expenses and also just because of how convoluted every governmentally run program is to apply for.

My situation now: I am in need of about $25,000 USD for school this upcoming year. I was able to receive a small amount of an unsubsidized loan already from FAFSA, but they aren’t offering me more and determine my SAI to be high due to the fact that within the past few (less than 5) years my parents have gotten better paying jobs. It feels so unfair that they only judge your need based on income and not income-to-debt, or recognize that ALMOST ALL OF OUR MONEY IS GOING TO PAY OFF OLD MEDICAL BILLS IN THIS COUNTRY THAT CHARGES $75 FOR A BAND-AID!!! There is no additional student aid program for disabled students!

Our credit scores are all terrible because of how many times we’ve had to take out loans and put medical bills on credit cards after my dad’s major procedures and even our regular copays and medication costs. I’ve been approved for a Sallie Mae loan last year, but now I am not getting approved for one this year. My school doesn’t accept many other types of student/education specific program funding directly (due to the international aspect?), and at this point I don’t care if I need to take out a personal loan with a terrible interest rate and transfer that money to my student account- I just need to finish my program.

So basically, I am in desperate need of advice and recommendations of where else to go for getting loans or if anybody knows of any scholarship opportunities for disabled students, or hell even if there’s a way to eliminate our medical debt through some forgiveness program as that would get rid of my family’s main issue entirely. We are just completely stuck and I really don’t want to quit on my education especially when I’ve gotten this far and already accrued education debt from what I’ve already started.","https://www.reddit.com/r/college/comments/1lvnf15/financial_aid_advice_for_a_disabled_student_with/","1752078923.0","college","OkRecover5897"
"how to get grades up in a week?","i have a 43 in physics and a 25 in ap english lang. how can i get my grades up in a week? i’m so overwhelmed ","https://www.reddit.com/r/highschool/comments/1lvlump/how_to_get_grades_up_in_a_week/","1752075233.0","highschool","FunnyYak3131"
"i feel like a failure and don’t deserve the program i’m in","Just a rant because I feel lost and overwhelmed. Yesterday I enrolled to one of the best universities in my country as a freshman and got the first day because I was one of the top scorers. I was a STEM student who applied to an english language studies program because I’ve always loved writing. There were so many people vying for slots that I ended up waiting for four hours just to finally go and sit where I’ll be interviewed. 

The dean of the program interviewed me and I just completely sucked. I’ve always had trouble communicating and bad anxiety problems but I didn’t think it would come biting me back at such a crucial time. I completely blanked out and couldn’t answer a basic question, something related to the eight parts of a speech and I couldn’t answer at all, only half. Which I remembered right after the interview. It was so bad I forgot about what even happened. Although I still got accepted in the program somehow, I still can’t forget how the dean told me how she could even accept me in when I couldn’t answer such a basic question. 

Her assistant (the one who actually was assigned to do the interviews) took over, and he spoke to me about how impressive and high my grades were but how he valued performance over numbers. And that since I was the first applicant he wanted to accept me despite my situation and that because there were many programs but I still chose them, he was willing to give me a slot but that he would remember me. I can’t help but feel I barely got in and ONLY got in because I was pitied. That I truly don’t deserve a place there. I feel humiliated by how I let my anxiety get the best of me at such an important moment and embarrassed that it was the first impression of me that the most important people of my program got. I don’t know if I actually deserve to go here and feel like I’ll never catch up with my future classmates. I don’t know how to cope with my self doubts anymore because of how anxious I am all the time. ","https://www.reddit.com/r/CollegeRant/comments/1luopqm/i_feel_like_a_failure_and_dont_deserve_the/","1751981680.0","CollegeRant","yourbestmistkifan"
"Feeling frustrated with my experience so far","I've been taking classes entirely online at a community college because I don't have a way to get to class and I can't afford university right now... It's been pretty bad to say the least. I'm taking summer classes right now, and this is my first year. I haven't been on campus at all. I haven't made any friends or had any kind of fun experience because I just can't afford it. It's really disheartening seeing my friends post about their experiences at university and I'm still at home. All I do is do my assignments and then go to work. 

Moreover, some of this classes are just? Terrible? I've been taking classes nonstop, no breaks, and I am kind of reaching the end of my rope. Especially when I keep getting classes where the teacher doesn't even interact with the class at all or provide any instruction. Out of all the classes I've taken so far, I've had ONE teacher do recorded lectures. (And they don't even help. She posts several of them on Monday, all for one unit, then has an assignment due on Tuesday that tanks my overall grade at least 5 points if I score anything below an 80.)

I'm just tired. I'm tired of missing out. I'm tired of doing schoolwork. Tired of teaching myself everything. I wanted to get my associates and transfer to a university to save money but at this rate I don't even think I'll make it there. It doesn't feel like there's even a point to any of it at all. I didn't even want to go to college but it feels like if I ever want to make any kind of money that I have to. I used to be an incredible student in highschool but I just hate college. If I drop out now I'll never hear the end of it from my family... I don't think I will drop out but I can't get over the fact that the second I stop having assignments, my mental health immediately improves. I just had a week long break (for some reason my college gave us one but I'm not complaining) and the moment it ended, my mental health tanked. Throughout my life my mental health has always been really bad, with a lot of suicidal ideation and even attempts. But the moment I get a break from school, it just seems to melt away. I never wanted to go back to school. I just wanted to stop feeling so bad but it seems I don't have a choice. Just this first year alone I've had a few close calls. It's terrible.


 I just wanted to be a park ranger, but even that requires a bachelor's. It feels so hopeless.","https://www.reddit.com/r/CollegeRant/comments/1lu7efh/feeling_frustrated_with_my_experience_so_far/","1751925642.0","CollegeRant","blueratatouille"
"I’m a huge college hater despite being a good student.","I go to a U.S. college in the Midwest.

Anytime I talk to people they tell me I should just “do what makes me happy” but I really just want to get my bachelor’s over with. 

I’m taking summer classes rn and going into my 3rd year. I’m so insanely burnt out and I just can’t seem to stay on top of all my classes and responsibilities consistently. 

My perspective on college is super negative, and I tried my best to be delusional and romanticize it as much as possible but I just can’t.

This is my experience:
- Balancing a social life is insanely difficult (there’s nothing fun to do in a Midwest town, my friends are working or at different colleges/we drifted apart, making new friends is pointless because we’re not gonna be taking the same classes to really invest time in connecting)
- My family is constantly downplaying how hard it is and telling me to eat a snack, take a nap, or just being loud when I’m trying to study (no one has a degree/people dropped out or never tried- I’m trying not to follow)
- Professors are just on constant power trips that you have to kiss up to them. The phrase “teachers make or break your grade” has never hit harder. I feel even worse when I get actual good professors but I fall behind because I’m catching up in the courses of the bad ones.
- Getting a good or bad grade doesn’t even register to me anymore. Good grade? Gee, on to the next. Bad grade? Damn, doesn’t even matter. 
- The scholarships I got barely cover anything, and all the $ I get from doing part-time jobs go right back into school. Debt is accumulating.
- College is essentially spending money to teach yourself, maneuvering professors, class projects, time-wasting assignments, and spending time in lecture halls trying not to lose your mind. 
- The material that’s relatively easy just end up being time-consuming for no reason, and the material that’s hard just burns me out cause I know it’ll either be something I never use again or something I’ll “barely” apply in the future. 
- Your worth being summed up in percentages, point systems, papers, exams, participation- actually insane. How bout I jump out this mf window and touch some grass!
- Gen-Ed’s and electives have got to be the dumbest money scams disguised as being a “well-rounded education.”
- College being the time to explore can be a lie when they ruin your favorite subjects and/or add up time to graduate.
- Oh you took this difficult class cause it was required? Never mind, it’s actually not required anymore so you wasted your time and it just counts as random credit hours now!
- Oh you thought these were the classes you were supposed to take and you planned out your four years already? Oops, we added a few more required classes cause we wanted to “improve the the curriculum,” have fun adding those in.
- Staring at a laptop for hours on end every day whether I move locations or not never gets better.
- My will to live is gone, my social life is barely hanging on, and the burnout will only get worse from here.
- My hobbies aren’t even enjoyable anymore because I’m thinking about all the things I have to do.
- I’ve pretty much calculated every possible route I could take for my future and I can’t help but feel like I’m a failure and college just isn’t meant for me. 
- Time, energy, money, all getting depleted simultaneously for a piece of paper that shows people “hey look I can do this”
- College is truly the boss that ends all if you can’t stay disciplined or romanticize it.
- I honestly feel better when people collectively say, “college sucks and the system sucks but we’re here” instead of “everything in life is hard, choose your hard” like oh lawd ik gimme a break

Thank you for letting me rant. If anyone has shitty stories I’d love to hear them.","https://www.reddit.com/r/CollegeRant/comments/1ltt42k/im_a_huge_college_hater_despite_being_a_good/","1751892012.0","CollegeRant","Square-Run3431"
"We should do a Digital occupy Wall Street.","We’re all angry and we go out we protest we go home. We’re all burnt out and don’t have a lot of connection so we seek it through are phone and “they” like it that way bc they know they can sell us something for that dopamine hit. 

They don’t feel the hurt because they’re still making money. They only care about the economy…BUT WE ARE THE ECONOMY. 


During the target ~boycott~ their digital sales went up even though their stores had less consumers it works out for them.

Amazon is successful because they turned retail store fronts into a logistics company…
They benefit more from the online shopping and can schedule less store employees. $$$$ for them. 



-Amazon controls 38% of US e-commerce.
-Millions canceling Prime for even 1 month would show up in quarterly earnings.

-Google, FACEBOOK, meta, instagram make millions in ad revenue. 


-These people are turning us into home shopping network and getting free employees free marketing all for the enticement of getting a following and being financially free. 

Gen Z makes up 40% of US consumers and 90% of TikTok users. If just 5 million people boycott Amazon for 1 month, they lose over $1 billion in revenue.

If 10 million people stop watching YouTube for a week, Google ad revenue drops by tens of millions.


We got the numbers. We don’t even need to leave our houses. 

We can have the safety of decentralized movement. 

No single park. No leaders to arrest. No HQ to raid just us screwing them over. 

**If this post gets ANY comments or traction I will be surprised because it’s an all text post. 🙃**","https://www.reddit.com/r/GenZ/comments/1lvqwnt/we_should_do_a_digital_occupy_wall_street/","1752087006.0","GenZ","Whatever-always"
